{
  "schema_version": "0.1.0",
  "stage": "9-prep",
  "layer": "outcome series, drawn from the analytical base",
  "vintage": "2026-10-18",
  "generated_at": "2026-10-27T03:18:49+0100",
  "generator": {
    "script": "analysis/R/07_series_figures.R",
    "git_sha": "ff2757c"
  },
  "spec": {
    "path": "analysis/specs/series_figures.yml",
    "md5": "1cbdeaa59c337068d09346e6ad623f93",
    "version": 1
  },
  "verifier": "tests/verify_series_figures.py",
  "input": {
    "database": "data/analytics.duckdb",
    "fact_table": "main_analytics.fact_metric",
    "native_table": "main_analytics.fact_observation_native",
    "metric_dimension": "main_analytics.dim_metric",
    "definition_break_table": "main_analytics.dim_definition_break",
    "outcomes_spec": "analysis/specs/outcomes.yml",
    "outcomes_spec_md5": "03eb498e0bc746a027a5fb1268597cb9"
  },
  "window": {
    "first": "1999-01",
    "last": "2026-10"
  },
  "counts": {
    "outcomes": 12,
    "drawable": 12,
    "flagged": 8,
    "with_definition_break": 3,
    "spine_rows": {
      "observed": 764,
      "interpolated": 1826,
      "unobserved": 1418
    }
  },
  "marks": {
    "observed": "solid point at the anchor month, joined only to an adjacent observed month",
    "interpolated": "dotted grey segment — a month the monthly spine filled between two observations",
    "unobserved": "nothing drawn; a run of this many months or more is shaded and labelled",
    "min_shaded_run_months": 3
  },
  "outcomes": [
    {
      "id": "u5mr",
      "label": "Under-5 mortality rate",
      "short": "Under-5 mortality",
      "domain": "health",
      "unit": "per 1,000 live births",
      "direction": "down",
      "source": "NDHS / UN IGME",
      "native_frequency": "annual",
      "quality_status": "ok",
      "drawable": true,
      "window": {
        "first": "1999-01",
        "last": "2026-10"
      },
      "observations": {
        "observed": 26,
        "interpolated": 275,
        "unobserved": 33
      },
      "native_in_window": 26,
      "first_observed": "1999-07",
      "last_observed": "2024-07",
      "definition_breaks": [],
      "caption": "26 observations in the window (1999-07 to 2024-07); 275 months interpolated by the monthly spine; 33 months with no observation. Native frequency annual; Stage 3 status ok. The series stops at 2024-07, so the remainder of the window carries no observation.",
      "figure": {
        "path": "registry/series/2026-10-18/figures/u5mr.svg",
        "bytes": 51961
      }
    },
    {
      "id": "mmr",
      "label": "Maternal mortality ratio",
      "short": "Maternal mortality",
      "domain": "health",
      "unit": "per 100,000 births",
      "direction": "down",
      "source": "World Bank SH.STA.MMRT (UN MMEIG estimates)",
      "native_frequency": "annual",
      "quality_status": "ok",
      "drawable": true,
      "window": {
        "first": "1999-01",
        "last": "2026-10"
      },
      "observations": {
        "observed": 25,
        "interpolated": 264,
        "unobserved": 45
      },
      "native_in_window": 25,
      "first_observed": "1999-07",
      "last_observed": "2023-07",
      "definition_breaks": [],
      "caption": "25 observations in the window (1999-07 to 2023-07); 264 months interpolated by the monthly spine; 45 months with no observation. Native frequency annual; Stage 3 status ok. The series stops at 2023-07, so the remainder of the window carries no observation.",
      "figure": {
        "path": "registry/series/2026-10-18/figures/mmr.svg",
        "bytes": 50122
      }
    },
    {
      "id": "immun_penta3",
      "label": "Penta3 immunisation coverage",
      "short": "Penta3 coverage",
      "domain": "health",
      "unit": "% surviving infants",
      "direction": "up",
      "source": "World Bank SH.IMM.IDPT (DPT3, WHO/UNICEF WUENIC)",
      "native_frequency": "annual",
      "quality_status": "flagged",
      "drawable": true,
      "window": {
        "first": "1999-01",
        "last": "2026-10"
      },
      "observations": {
        "observed": 26,
        "interpolated": 275,
        "unobserved": 33
      },
      "native_in_window": 26,
      "first_observed": "1999-07",
      "last_observed": "2024-07",
      "definition_breaks": [],
      "caption": "26 observations in the window (1999-07 to 2024-07); 275 months interpolated by the monthly spine; 33 months with no observation. Native frequency annual; Stage 3 status flagged. The series stops at 2024-07, so the remainder of the window carries no observation.",
      "figure": {
        "path": "registry/series/2026-10-18/figures/immun_penta3.svg",
        "bytes": 52306
      }
    },
    {
      "id": "skilled_birth",
      "label": "Skilled birth attendance",
      "short": "Skilled birth attendance",
      "domain": "health",
      "unit": "% of births",
      "direction": "up",
      "source": "World Bank SH.STA.BRTC.ZS (survey-based)",
      "native_frequency": "annual",
      "quality_status": "flagged",
      "drawable": true,
      "window": {
        "first": "1999-01",
        "last": "2026-10"
      },
      "observations": {
        "observed": 8,
        "interpolated": 11,
        "unobserved": 315
      },
      "native_in_window": 8,
      "first_observed": "1999-07",
      "last_observed": "2022-07",
      "definition_breaks": [],
      "caption": "8 observations in the window (1999-07 to 2022-07); 11 months interpolated by the monthly spine; 315 months with no observation. Native frequency annual; Stage 3 status flagged. The series stops at 2022-07, so the remainder of the window carries no observation.",
      "figure": {
        "path": "registry/series/2026-10-18/figures/skilled_birth.svg",
        "bytes": 13082
      }
    },
    {
      "id": "literacy_youth",
      "label": "Youth literacy (15-24)",
      "short": "Youth literacy",
      "domain": "education",
      "unit": "%",
      "direction": "up",
      "source": "NBS / UNESCO UIS",
      "native_frequency": "annual",
      "quality_status": "flagged",
      "drawable": true,
      "window": {
        "first": "1999-01",
        "last": "2026-10"
      },
      "observations": {
        "observed": 7,
        "interpolated": 0,
        "unobserved": 327
      },
      "native_in_window": 7,
      "first_observed": "2003-07",
      "last_observed": "2024-07",
      "definition_breaks": [],
      "caption": "7 observations in the window (2003-07 to 2024-07); 0 months interpolated by the monthly spine; 327 months with no observation. Native frequency annual; Stage 3 status flagged. The series stops at 2024-07, so the remainder of the window carries no observation.",
      "figure": {
        "path": "registry/series/2026-10-18/figures/literacy_youth.svg",
        "bytes": 11308
      }
    },
    {
      "id": "primary_completion",
      "label": "Primary completion rate",
      "short": "Primary completion",
      "domain": "education",
      "unit": "%",
      "direction": "up",
      "source": "NEMIS / World Bank",
      "native_frequency": "annual",
      "quality_status": "flagged",
      "drawable": true,
      "window": {
        "first": "1999-01",
        "last": "2026-10"
      },
      "observations": {
        "observed": 8,
        "interpolated": 66,
        "unobserved": 260
      },
      "native_in_window": 8,
      "first_observed": "2000-07",
      "last_observed": "2010-07",
      "definition_breaks": [],
      "caption": "8 observations in the window (2000-07 to 2010-07); 66 months interpolated by the monthly spine; 260 months with no observation. Native frequency annual; Stage 3 status flagged. The series stops at 2010-07, so the remainder of the window carries no observation.",
      "figure": {
        "path": "registry/series/2026-10-18/figures/primary_completion.svg",
        "bytes": 19490
      }
    },
    {
      "id": "ner_primary",
      "label": "Net enrolment rate, primary",
      "short": "Net enrolment (primary)",
      "domain": "education",
      "unit": "%",
      "direction": "up",
      "source": "NEMIS",
      "native_frequency": "annual",
      "quality_status": "flagged",
      "drawable": true,
      "window": {
        "first": "1999-01",
        "last": "2026-10"
      },
      "observations": {
        "observed": 9,
        "interpolated": 77,
        "unobserved": 248
      },
      "native_in_window": 9,
      "first_observed": "1999-07",
      "last_observed": "2010-07",
      "definition_breaks": [],
      "caption": "9 observations in the window (1999-07 to 2010-07); 77 months interpolated by the monthly spine; 248 months with no observation. Native frequency annual; Stage 3 status flagged. The series stops at 2010-07, so the remainder of the window carries no observation.",
      "figure": {
        "path": "registry/series/2026-10-18/figures/ner_primary.svg",
        "bytes": 21486
      }
    },
    {
      "id": "fatalities",
      "label": "Reported security fatalities",
      "short": "Security fatalities",
      "domain": "security",
      "unit": "count",
      "direction": "down",
      "source": "UCDP GED (bulk archive, keyless)",
      "native_frequency": "monthly",
      "quality_status": "flagged",
      "drawable": true,
      "window": {
        "first": "1999-01",
        "last": "2026-10"
      },
      "observations": {
        "observed": 287,
        "interpolated": 0,
        "unobserved": 47
      },
      "native_in_window": 287,
      "first_observed": "1999-01",
      "last_observed": "2024-12",
      "definition_breaks": [],
      "caption": "287 observations in the window (1999-01 to 2024-12); 0 months interpolated by the monthly spine; 47 months with no observation. Native frequency monthly; Stage 3 status flagged. The series stops at 2024-12, so the remainder of the window carries no observation.",
      "figure": {
        "path": "registry/series/2026-10-18/figures/fatalities.svg",
        "bytes": 81294
      }
    },
    {